Rank,Country,Team,Time
1,Ethiopia,Eyerusalem Kuma Bezunesh Bekele Teyba Erkesso,3:36:00
2,Romania,Constantina Diţă-Tomescu Mihaela Botezan Luminița Talpoș,3:36:08
3,Russia,Irina Timofeyeva Alina Ivanova Yelena Burykina,3:38:21
4,Japan,Yuki Saito Kei Terada Keiko Isogai,3:38:51
5,Italy,Gloria Marconi Patrizia Tisi Ivana Iozzia,3:43:39
6,France,Fatiha Klilech-Fauvel Christelle Daunay Yamna Oubouhou,3:46:26
7,United States,Emily Nay Kimberly Fitchen-Young Melissa White,3:53:31
8,India,Geeta Rani Sarita Marbade Purshot Laima Devi,4:11:00
-,Kenya,Lydia Cheromei Rita Sitienei Jeptoo Emily Kimuria,DNF
