Date,Event,Country,Winner
29 February,"Australia World Cup , Geelong",Australia,Oenone Wood ( AUS )
20 March,Primavera Rosa,Italy,Zulfiya Zabirova ( RUS )
28 March,GP Castilla y León,Spain,Angela Brodtka ( GER )
4 April,Tour of Flanders for Women,Belgium,Zulfiya Zabirova ( RUS )
21 April,La Flèche Wallonne Féminine,Belgium,Sonia Huguet ( FRA )
29 May,Coupe du Monde Cycliste Féminine de Montréal,Canada,Geneviève Jeanson ( CAN )
29 August,GP de Plouay,France,Edita Pučinskaitė ( LIT )
5 September,Lowland International Rotterdam Tour,Netherlands,Petra Rossner ( GER )
11 September,Rund um die Nürnberger Altstadt,Germany,Petra Rossner ( GER )
