Rank,Country,Team,Time
1,Ethiopia,Meseret Hailu Feyse Tadese Emebt Etea,3:27:52
2,Kenya,Paskalia Chepkorir Kipkoech Lydia Cheromei Pauline Njeri Kahenya,3:28:39
3,Japan,Tomomi Tanaka Mai Ito Asami Kato,3:34:45
4,United Kingdom,Gemma Steel Caryl Jones Susan Partridge,3:36:56
5,United States,Maegan Krifchin Adriana Nelson Shalane Flanagan,3:40:40
6,South Africa,René Kalmer Nolene Conrad Christine Kalmer,3:50:47
7,Mexico,Sara Prieto Marisol Romero Maritza Arenas,3:51:45
8,Brazil,Sueli Silva Sirlene de Pinho Adriana da Luz,3:54:45
9,Bulgaria,Anita Krasteva Silviya Danekova Iveta Bonova,4:11:05
