Episode,Couple 1,Couple 2,Couple 3,Original air date
1,Jimi Mistry with wife Flavia Cacace,Martina Navratilova with wife Julia Lemigova,Sean Fletcher with wife Luned,30 September 2015
2,Catherine Tyldesley with fiancé Tom,Matt Dawson with wife Carolin,Tinchy Stryder with partner Helen,7 October 2015
3,Kelvin Fletcher with fiancée Elizabeth,Gemma Merna with husband Ian,Mr Motivator with wife Palmer,14 October 2015
4,Quentin Willson with wife Michaela,Jermaine Jenas with wife Ellie,Billie Faiers with fiancé Greg,21 October 2015
5,Rochelle Humes with husband Marvin Humes,Vicki Michelle with husband Graham,Tom Parker with partner Kelsey,28 October 2015
6,Chris Chittell with fiancée Lesley Dunlop,Tessa Sanderson with husband Densign,Rylan Clark with fiancé Dan Neal,4 November 2015
7,Mikey North with fiancée Rachael,Cheryl Baker with husband Steve,Martin Offiah with fiancée Virginia,18 November 2015
8,Carl Fogarty with wife Michaela,Vernie Bennett with husband Bryan,Alex Brooker with wife Lynsey,25 November 2015
