Awards,Created,Description,Recent winners
Armourers and Brasiers ' Company Prize,1984,Awarded biennially for excellence in materials science and technology the Armourers and Brasiers ' Company Prize is sponsored by the Worshipful Company of Armourers and Brasiers and is accompanied by a £ 2000 gift,Steven Armes 2018
GlaxoSmithKline Prize and Lecture,1976,"Awarded biennially for original contributions to medical and veterinary sciences published within ten years from the date of the award the GlaxoSmithKline Prize and Lecture is both an award and a lecture , and is accompanied by a £2500 gift . The award was initially sponsored by the Wellcome Trust in 1986 but in 2002 was renamed the GlaxoSmithKline Prize",Andrew Hattersley 2016
Michael Faraday Prize,1986,"Awarded annually for excellence in communicating science to UK audiences the winner of the Michael Faraday Prize is expected to give a lecture , where he or she will be presented with the £2500 gift that accompanies the prize",Martyn Poliakoff 2019
Milner Award,2012,"The Royal Society Milner Award , supported by Microsoft Research , is given annually for outstanding achievement in computer science by a European researcher . It replaces the Royal Society and Académie des sciences Microsoft Award and is named in honour of Professor Robin Milner FRS ( 1934-2010 ) , a pioneer in computer science",Cordelia Schmid 2020
Mullard Award,1967,"Awarded to an individual who has an outstanding academic record in any area of natural science , engineering or technology and whose work is currently making or has the potential to make a contribution to national prosperity in the United Kingdom the Mullard Award is aimed at scientists and engineers in the early stages of their career and is accompanied by a £2000 gift",Hagan Bayley 2019
Royal Society Africa Prize,2016,"To recognise research scientists based in Africa who are making an innovative contribution to the biological sciences , including basic medical science , which contributes significantly to capacity building in Africa . The winner will receive an £11,000 grant towards her research project , a bronze medal and a gift of £1,000",Henry Mwandumba 2019
Royal Society Athena Prize,2016,"Awarded biennially ( in even years ) for individuals and teams , working in UK academic and research communities , who have contributed most to the advancement of diversity in science , technology , engineering and mathematics ( STEM ) within their communities . The recipients of the prize receive a medal and a gift of £5,000",Emma Chapman 2018
Royal Society Prize for Science Books,1988,"Currently known as the Royal Society Insight Investment Science Book Prize , it is awarded annually to the book judged to be the previous year 's best general science writing for a non-specialist reader . The winner receives £25,000",Andrea Wulf 2016
Rosalind Franklin Award,2003,"Awarded annually for an outstanding contribution to any area of Science , Technology , Engineering and Mathematics ( STEM ) the Rosalind Franklin Award is accompanied by a £30,000 research grant and is awarded exclusively to women",Nguyễn Thị Kim Thanh 2019
