Order,Artist,Song ( original artists ),Result
1,Monde Msuthwana,Unchained Melody ( The Righteous Brothers ),Eliminated
2,Bianca Bronn,Out of Reach ( Gabrielle ),Eliminated
3,Lesedi Job,Georgia on My Mind ( Ray Charles ),Eliminated
4,Nazneen Leeman,Sunny Came Home ( Shawn Colvin ),Advanced
5,Lwazi Mkhize,How Am I Supposed to Live Without You ( Michael Bolton ),Eliminated
6,Zama Sithole,You Ca n't Hurry Love ( The Supremes ),Eliminated
7,Andy Milner,I Say a Little Prayer ( Aretha Franklin ),Eliminated
8,Poseletso Sejosingoe,I Drove All Night ( Cyndi Lauper ),Advanced
