Year,Winner,Nominees
1994,Jann Arden,Charlie Major Jim Witter Mario Pelchat Meryn Cadell
1995,Susan Aglukark,Andrew Matheson David Gogo Éric Lapointe Sara Craig
1996,Ashley MacIsaac,Amanda Marshall Kim Stockwood Lara Fabian Laura Smith
1997,Terri Clark,Chantal Kreviazuk Damhnait Doyle Duane Steele Wendy Lands
1998,Holly McNarland,Amy Sky Dayna Manning Lhasa de Sela Tariq
1999,Melanie Doane,Bruce Guthro Emm Gryner Hayden Tamia
2000,Tal Bachman,Ivana Santilli Jorane Tara Lyn Hart Tory Cassis
2001,Nelly Furtado,Adam Gregory Amanda Stott j. englishman Sarah Harmer
2002,Hawksley Workman,Gabrielle Destroismaisons Jelleestone Maren Ord Thrust
