Church,Dates,"City , State"
"Methodist Episcopal Church , South ( Bald Knob , Arkansas )",1992 NRHP-listed,"Bald Knob , Arkansas"
Bethel African Methodist Episcopal Church,1882 built 1986 NRHP-listed,"Batesville , Arkansas"
"Bigelow Methodist Episcopal Church , South",1908 built 1996 NRHP-listed,"Bigelow , Arkansas"
Calico Rock Methodist Episcopal Church,1924 built 2007 NRHP-listed,"Calico Rock , Arkansas"
Two Bayou Methodist Church and Cemetery,1875 built 1998 NRHP-listed,"Camden , Arkansas"
Camp Methodist Church,1878 built 1997 NRHP-listed,"Camp , Arkansas"
Mt . Zion Methodist Church,built NRHP-listed,"Carthage , Arkansas"
Frenchman 's Mountain Methodist Episcopal Church-South and Cemetery,built NRHP-listed,"Cato , Arkansas"
Smyrna Methodist Church,built NRHP-listed,"Center Hill , Arkansas"
Clarendon Methodist-Episcopal Church South,built NRHP-listed,"Clarendon , Arkansas"
First United Methodist Church,built NRHP-listed,"Conway , Arkansas"
Crossett Methodist Church,1949 built 2010 NRHP-listed,"Crossett , Arkansas"
"Methodist Episcopal Church , South ( Dardanelle , Arkansas )",built NRHP-listed,"Dardanelle , Arkansas"
First United Methodist Church,1923 built 1992 NRHP-listed,"DeWitt , Arkansas"
Emmet Methodist Church,built NRHP-listed,"Emmet , Arkansas"
First United Methodist Church,1925 built 1983 NRHP-listed,"Fordyce , Arkansas"
Dodson Avenue Methodist Episcopal Church,built NRHP-listed,"Fort Smith , Arkansas"
First United Methodist Church,built NRHP-listed,"Forrest City , Arkansas"
First United Methodist Church,built NRHP-listed,"Hamburg , Arkansas"
"Houston Methodist Episcopal Church , South",built NRHP-listed,"Houston , Arkansas"
