Site,Municipality,Ref
Nishida Family Gardens ( Gyokusen-en ) 西田家庭園 Nishida-ke teien,Kanazawa,[ 11 ]
Raikō-ji Gardens 来迎寺庭園 Raikōji teien,Anamizu,[ 12 ]
Myōjō-ji Gardens 妙成寺 庭園 Myōjōji teien,Hakui,[ 13 ]
Honsen-ji Gardens 二保本泉寺九山八海の庭 Futamata Honsenji kusen-hakkai no niwa,Kanazawa,[ 14 ]
Taira Family Gardens 平家庭園 Taira-ke teien,Shika,[ 15 ]
Oyama Jinja Gardens 尾山神社庭園 ( 旧金谷御殿庭園 ) Oyama Jinja teien ( kyū-Kanaya goten teien ),Kanazawa,[ 16 ]
Seisonkaku Middle Garden 成巽閣中庭 Seisonkaku nakaniwa,Kanazawa,[ 17 ]
Name Falls 男女滝 Name-taki,Wajima,[ 18 ]
Oke Falls 桶滝 Oke-daki,Wajima,[ 19 ]
