Name,Department,Year,Award,Citation
David Baltimore,Biology,1975,Medicine/Physiology,for their discoveries concerning the interaction between tumour viruses and the genetic material of the cell
Robert Engle,Economics,2003,Economics,for methods of analyzing economic time series with time-varying volatility ( ARCH )
Daniel L. McFadden,Economics,2000,Economics,for his development of theory and methods for analyzing discrete choice
"John Forbes Nash , Jr",Economics,1994,Economics,for [ his ] pioneering analysis of equilibria in the theory of non-cooperative games
Myron S. Scholes,Economics,1997,Economics,for a new method to determine the value of derivatives
K. Barry Sharpless,Chemistry,2001,Chemistry,for his work on chirally catalysed oxidation reactions
Charles H. Townes,Physics,1964,Physics,"for fundamental work in the field of quantum electronics , which has led to the construction of oscillators and amplifiers based on the maser-laser principle"
Steven Weinberg,Physics,1979,Physics,"for their contributions to the theory of the unified weak and electromagnetic interaction between elementary particles , including , inter alia , the prediction of the weak neutral current"
