Name,Class year,Notability
George Washington Bethune,1822,Dutch Reformed minister and author
Joseph Clemens,1894,"U.S. Army chaplain , missionary and plant collector"
Moncure Conway,1849,"Minister , author , abolitionist"
George R. Crooks,1840,Minister ; editor of The Methodist ; professor at Drew Theological Seminary
George David Cummins,1841,Founder of Reformed Episcopal Church
William Perry Eveland,1892,Bishop of the Methodist Episcopal Church
Frederick Brown Harris,1909,Twice Chaplain of the United States Senate
Robert Samuel Maclay,1845,"Missionary who made pioneer contributions to the Methodist Episcopal missions in China , Japan and Korea"
John Wesley Lord,1927,Bishop of the Methodist Church ; Vice President of the National Council of Churches
