Universe,Origin film,Start date,End date,Connecting franchises
Rocky,Rocky,1976,Present,Rocky and Creed
The Mummy,The Mummy,1999,2017,The Mummy and The Scorpion King
The X-Men Saga,X-Men,2000,2020,"X-Men , Wolverine and Deadpool"
Middle-earth,The Lord of the Rings : The Fellowship of the Ring,2001,2014,The Lord of the Rings and The Hobbit
Wizarding World,Harry Potter and the Philosopher 's Stone,2001,Present,Harry Potter and Fantastic Beasts
Cars,Cars,2006,Present,Cars and Planes
Despicable Me,Despicable Me,2010,Present,Despicable Me and Minions
The Conjuring Universe,The Conjuring,2013,Present,"The Conjuring , Annabelle , The Nun and The Curse of La Llorona"
The Lego Movie,The Lego Movie,2014,Present,"The Lego Movie , The Lego Batman Movie and The Lego Ninjago Movie"
