Name,Location,Year,Architectural style
Wapauwe Old Mosque Masjid Tua Wapauwe,"Central Maluku Regency , Maluku 3°35′07″S 128°05′03″E / 3.585226°S 128.084243°E / -3.585226 ; 128.084243 ( Wapauwe Old Mosque )",1414 ? ( established ),Javanese
Ampel Mosque Masjid Ampel ꦩꦱ꧀ꦗꦶꦢ꧀ꦲꦩ꧀ꦥꦺꦭ꧀,"Surabaya , East Java 7°13′47″S 112°44′33″E / 7.2296°S 112.7426°E / -7.2296 ; 112.7426 ( Ampel Mosque )","1421 ( original column , mosque has been restored several times )",Javanese
Great Mosque of Demak Masjid Agung Demak ꦩꦱ꧀ꦗꦶꦢ꧀ꦲꦒꦸꦁꦢꦺꦩꦏ꧀,"Demak Regency , Central Java 6°53′41″S 110°38′15″E / 6.8946°S 110.6374°E / -6.8946 ; 110.6374 ( Great Mosque of Demak )","1466 , 1506",Javanese
Red Mosque of Panjunan Masjid Merah Panjunan ᮙᮞ᮪ᮏᮤᮓ᮪ ᮙᮦᮛᮂ ᮕᮔ᮪ᮏᮥᮔᮔ᮪ ꦩꦱ꧀ꦗꦶꦢ꧀ꦩꦺꦫꦃꦥꦤ꧀ꦗꦸꦤ꧀,"Cirebon , West Java 6°43′03″S 108°33′58″E / 6.7175°S 108.5660°E / -6.7175 ; 108.5660 ( Red Mosque of Panjunan )",1480,Javanese
Great Mosque of Cirebon Masjid Agung Cirebon ᮙᮞ᮪ᮏᮤᮓ᮪ ᮃᮌᮨᮀ ᮎᮤᮛᮨᮘᮧᮔ᮪ ꦩꦱ꧀ꦗꦶꦢ꧀ꦲꦒꦸꦁꦕꦶꦫꦺꦧꦺꦴꦤ꧀,"Cirebon , West Java 6°43′32″S 108°34′12″E / 6.725547°S 108.569919°E / -6.725547 ; 108.569919 ( Great Mosque of Cirebon )",1489,Javanese
Menara Kudus Mosque Masjid Menara Kudus ꦩꦱ꧀ꦗꦶꦢ꧀ꦩꦼꦤꦫꦑꦸꦢꦸꦱ꧀,"Kudus Regency , Central Java 6°48′15″S 110°49′58″E / 6.8042°S 110.8328°E / -6.8042 ; 110.8328 ( Menara Kudus Mosque )",1549,"Hindu temple -style ( minaret ) , Iranian ( mosque )"
Kasunyatan Mosque Masjid Kasunyatan ᮙᮞ᮪ᮏᮤᮓ᮪ ᮊᮞᮥᮑᮒᮔ᮪,"Serang Regency , Banten 6°03′03″S 106°09′26″E / 6.0509°S 106.1572°E / -6.0509 ; 106.1572 ( Kasunyatan Mosque )",Between 1570 and 1596,"Javanese , Portuguese , Hindu"
Mantingan Mosque Masjid Mantingan ꦩꦱ꧀ꦗꦶꦢ꧀ꦩꦤ꧀ꦠꦶꦔꦤ꧀,"Jepara Regency , Central Java 6°37′10″S 110°40′06″E / 6.6194°S 110.6683°E / -6.6194 ; 110.6683 ( Mantingan Mosque )",1556-1559,"Javanese , Tajug"
Great Mosque of Banten Masjid Agung Banten ᮙᮞ᮪ᮏᮤᮓ᮪ ᮠᮌᮨᮀ ᮘᮔ᮪ᮒᮨᮔ᮪,"Serang , Banten 6°02′10″S 106°09′14″E / 6.0360°S 106.1540°E / -6.0360 ; 106.1540 ( Great Mosque of Banten )",1560,Javanese
Tuo Kayu Jao Mosque Masjid Tuo Kayu Jao موساجيك توا كايو جاو,"Solok Regency , West Sumatra 1°00′16″S 100°37′43″E / 1.0044°S 100.6287°E / -1.0044 ; 100.6287 ( Tuo Kayu Jao Mosque )",1599,Minangkabau
Indrapuri Old Mosque Masjid Tua Indrapuri مسجد توا اندراڤوري,"Aceh Besar Regency , Aceh 5°24′55″N 95°26′48″E / 5.4154°N 95.4466°E / 5.4154 ; 95.4466 ( Indrapuri Old Mosque )",between 1607-1636,"Acehnese , Hindu"
Heritage Mosque of Banua Lawas Masjid Pusaka Banua Lawas ڤوساكا بانوا لاوس ماسيݢيت,"Tabalong Regency , South Kalimantan 2°16′49″S 115°12′43″E / 2.2803°S 115.2119°E / -2.2803 ; 115.2119 ( Heritage Mosque of Banua Lawas )",1625,Banjarese
Raya Syekh Burhanuddin Mosque Masjid Raya Syekh Burhanuddin موساجيك رايو الشيخ برهان الدين,"Padang Pariaman Regency , West Sumatra 0°41′S 100°12′E / 0.69°S 100.20°E / -0.69 ; 100.20 ( Raya Syekh Burhanuddin Mosque )",1670,Minangkabau
Jami Mosque of Sintang Masjid Jamik Sultan Nata 新当杰米清真寺 ماسيݢيت جميك سلطان ناتا,"Sintang Regency , West Kalimantan 0°05′N 111°29′E / 0.08°N 111.49°E / 0.08 ; 111.49 ( Jami Mosque of Sintang )",1672,Banjarese
Sultan of Ternate Mosque Masjid Sultan Ternate مسجد سلطان تيرنات,"Ternate City , North Maluku 0°47′56″N 127°23′05″E / 0.7989°N 127.3847°E / 0.7989 ; 127.3847",17th century,Javanese
Kyai Gede Mosque Masjid Kiai Gede ماسيݢيت كياهي ڬڎي,"West Kotawaringin Regency , Central Kalimantan 2°29′09″S 111°26′39″E / 2.4858°S 111.4443°E / -2.4858 ; 111.4443",after 1675,Banjarese
Al-Mansur Mosque Masjid Al-Mansur,"West Jakarta , Jakarta 6°09′S 106°49′E / 6.15°S 106.81°E / -6.15 ; 106.81",1717,Javanese
Sultan Suriansyah Mosque Masjid Sultan Suriansyah ماسيݢيت سلطان سوريانشاه,"Banjarmasin , South Kalimantan 3°17′39″S 114°34′34″E / 3.2943°S 114.5761°E / -3.2943 ; 114.5761",1746,"Javanese , Banjarese"
Jami Kampung Baru Inpak Mosque Masjid Jami Kampung Baru Inpak مسجد جامع كمڤوڠ بارو,"West Jakarta , Jakarta 6°08′12″S 106°48′10″E / 6.1366°S 106.8028°E / -6.1366 ; 106.8028",1748,"Javanese , Neoclassical"
Semarang Central Mosque Masjid Kauman Semarang ꦩꦱ꧀ꦗꦶꦢ꧀ꦑꦈꦩꦤ꧀ꦯꦼꦩꦫꦁ,"Semarang , Central Java 6°58′S 110°25′E / 6.97°S 110.42°E / -6.97 ; 110.42",1749,Javanese
