Club,League/Division,Lvl,State,City
Fawkner,Victorian State League Division 3,6,Victoria,Melbourne
Fernhill,District League,3,South Coast,Sydney
Fitzroy City,Victorian State League Division 2,5,Victoria,Melbourne
Floreat Athena,National Premier Leagues Western Australia,2,Western Australia,Perth
Forrestfield United,Football West State League Division 1,3,Western Australia,Perth
Frankston Pines,Victorian State League Division 2,5,Victoria,Melbourne
Fraser Park,National Premier Leagues NSW 3,4,New South Wales,Sydney
Freemantle City,Football West State League Division 1,3,Western Australia,Perth
Fulham United,National Premier Leagues State League 2,4,South Australia,Adelaide
