Site,Municipality,Type,Ref
Former Itō Denemon Family Gardens 旧伊藤傳右エ門氏庭園 kyū-Itō Denemon-shi teien,Iizuka,1,[ 1 ]
Former Kameishibō Gardens 旧亀石坊庭園 kyū-Kameishibō teien,Soeda,1,[ 2 ]
Tojima Family Gardens 戸島氏庭園 Tojima-shi teien,Yanagawa,1,[ 3 ]
Kiyomizu-dera Honbō Gardens 清水寺本坊庭園 Kiyomizudera honbō teien,Miyama,1,[ 4 ]
Gyoraku-en 藤江氏魚楽園 Fujie-shi Gyoraku-en,Kawasaki,1,[ 5 ]
Tachibana Family Gardens 立花氏庭園 Tachibana-shi teien,Yanagawa,1,[ 6 ]
Water Town of Yanagawa 水郷柳河 suikyō Yanagawa,Yanagawa,"3 , 10",[ 7 ]
Former Kurauchi Family Gardens 旧藏内氏庭園 kyū-Kurauchi-shi teien,Chikujō,1,[ 8 ]
