,Name on the Register,Date listed,Location,City or town
1,Bad Pass Trail,"October 29 , 1975 ( # 75000215 )",East of Warren along the Bighorn River in the Bighorn Canyon National Recreation Area 45°03′07″N 108°15′44″W / 45.051944°N 108.262222°W / 45.051944 ; -108.262222 ( Bad Pass Trail ),Warren
2,Bighorn Ditch Headgate,"December 12 , 1976 ( # 76000174 )",West of Fort Smith at the mouth of Bighorn Canyon 45°18′56″N 107°57′03″W / 45.315556°N 107.950833°W / 45.315556 ; -107.950833 ( Bighorn Ditch Headgate ),Fort Smith
3,Cedarvale,"August 19 , 1975 ( # 75000161 )",Present town of Hillsboro and its environs in the Bighorn Canyon National Recreation Area 45°05′53″N 108°13′26″W / 45.098056°N 108.223889°W / 45.098056 ; -108.223889 ( Cedarvale ),Hillsboro
4,Ewing-Snell Ranch,"May 12 , 1977 ( # 77000114 )",South of Dryhead 45°05′02″N 108°15′49″W / 45.083889°N 108.263611°W / 45.083889 ; -108.263611 ( Ewing-Snell Ranch ),Dryhead
5,Fort C.F . Smith Historic District,"October 10 , 1975 ( # 75000163 )",East of Fort Smith in the Bighorn Canyon National Recreation Area 45°17′59″N 107°54′59″W / 45.299722°N 107.916389°W / 45.299722 ; -107.916389 ( Fort C.F . Smith Historic District ),Fort Smith
6,Caroline Lockhart Ranch,"November 3 , 1989 ( # 89000155 )","Davis Creek , 70 miles south of Hardin 45°08′17″N 108°14′24″W / 45.138056°N 108.24°W / 45.138056 ; -108.24 ( Caroline Lockhart Ranch )",Dead Hill
7,M L Ranch,"July 15 , 1992 ( # 92000836 )","Off Alternate U.S. Route 14 near the eastern shore of Bighorn Lake , 13 miles east of Lovell , Bighorn Canyon National Recreation Area 44°49′49″N 108°09′28″W / 44.830278°N 108.157778°W / 44.830278 ; -108.157778 ( M L Ranch )",Lovell
8,Pretty Creek Archeological Site,"January 17 , 1975 ( # 75000162 )",Address Restricted,Hardin
