,Name on the Register,Date listed,Location,City or town
1,Drakesbad Guest Ranch,"October 22 , 2003 ( # 03001062 )","Head of Warner Creek Valley , Lassen Volcanic National Park 40°26′23″N 121°24′52″W / 40.439722°N 121.414444°W / 40.439722 ; -121.414444 ( Drakesbad Guest Ranch )",Chester
2,Horseshoe Lake Ranger Station,"May 5 , 1978 ( # 78000292 )",N of Chester in Lassen Volcanic National Park 40°28′23″N 121°19′48″W / 40.473056°N 121.33°W / 40.473056 ; -121.33 ( Horseshoe Lake Ranger Station ),Chester
3,Lassen Volcanic National Park Highway Historic District,"June 23 , 2006 ( # 06000527 )","NPS Route 1 , CA 89 40°30′02″N 121°30′38″W / 40.500556°N 121.510556°W / 40.500556 ; -121.510556 ( Lassen Volcanic National Park Highway Historic District )",Mineral
4,"Loomis Visitor Center , Bldg . 43","February 25 , 1975 ( # 75000177 )","Lassen Volcanic National Park 40°32′10″N 121°33′44″W / 40.536111°N 121.562222°W / 40.536111 ; -121.562222 ( Loomis Visitor Center , Bldg . 43 )",Manzanita Lake
5,Manzanita Lake Naturalist 's Services Historic District,"June 23 , 2006 ( # 06000525 )",39489 CA 44 40°32′08″N 121°33′51″W / 40.535556°N 121.564167°W / 40.535556 ; -121.564167 ( Manzanita Lake Naturalist 's Services Historic District ),Shingletown
6,Nobles Emigrant Trail,"October 3 , 1975 ( # 75000222 )",E of Shingletown in Lassen Volcanic National Park 40°32′50″N 121°25′29″W / 40.547222°N 121.424722°W / 40.547222 ; -121.424722 ( Nobles Emigrant Trail ),Shingletown
7,"Park Headquarters , Lassen Volcanic National Park","October 3 , 1978 ( # 06000490 )","Off CA 36 40°20′45″N 121°36′27″W / 40.345833°N 121.6075°W / 40.345833 ; -121.6075 ( Park Headquarters , Lassen Volcanic National Park )",Mineral
8,Summit Lake Ranger Station,"April 3 , 1978 ( # 78000296 )",NE of Mineral in Lassen Volcanic National Park 40°29′54″N 121°25′37″W / 40.498333°N 121.426944°W / 40.498333 ; -121.426944 ( Summit Lake Ranger Station ),Mineral
9,Warner Valley Ranger Station,"April 3 , 1978 ( # 78000364 )",N of Chester in Lassen Volcanic National Park 40°26′28″N 121°22′57″W / 40.441111°N 121.3825°W / 40.441111 ; -121.3825 ( Warner Valley Ranger Station ),Chester
